title,selftext,created_utc,score,num_comments,url,combined,hashtags,clean_tokens,sentiment,date
FBI says it will release video that officials say prove Jeffrey Epstein died by suicide,,1748559436.0,3856,761,https://www.latimes.com/world-nation/story/2025-05-29/fbi-to-release-video-that-officials-say-prove-jeffrey-epstein-was-not-murdered,fbi says it will release video that officials say prove jeffrey epstein died by suicide,[],"['fbi', 'says', 'release', 'video', 'officials', 'say', 'prove', 'jeffrey', 'epstein', 'died', 'suicide']",0.0,2025-05-29 22:57:16
Donald Trump faces backlash over Russ Vought pick: 'He lied',,1732371095.0,9465,1036,https://www.newsweek.com/russ-vought-trump-cabinet-project-2025-1990588,donald trump faces backlash over russ vought pick he lied,[],"['donald', 'trump', 'faces', 'backlash', 'russ', 'vought', 'pick', 'lied']",0.0,2024-11-23 14:11:35
Haley’s claim that America is ‘respected’ under Trump is pure gaslighting. Here are the facts.,,1539108113.0,2625,115,https://thinkprogress.org/nikki-haley-america-respect-trump-gaslighting-un-6f456c444edf/,haley s claim that america is respected under trump is pure gaslighting here are the facts,[],"['haley', 'claim', 'america', 'respected', 'trump', 'pure', 'gaslighting', 'facts']",0.21428571428571427,2018-10-09 18:01:53
"As Trump Gaslights Entire Nation About Package Bombs, This 'Will Go Down in History' as Clear Moment 'American Democracy Truly at Risk'",,1540486378.0,2967,100,https://www.commondreams.org/news/2018/10/25/trump-gaslights-entire-nation-about-package-bombs-will-go-down-history-clear-moment,as trump gaslights entire nation about package bombs this will go down in history as clear moment american democracy truly at risk,[],"['trump', 'gaslights', 'entire', 'nation', 'package', 'bombs', 'history', 'clear', 'moment', 'american', 'democracy', 'truly', 'risk']",-0.013888888888888892,2018-10-25 16:52:58
AOC defends Elizabeth Warren against 'misogynistic trope' after Democratic debate | 'It’s such gaslighting nonsense',,1582299163.0,1442,164,https://www.independent.co.uk/news/world/americas/us-election/aoc-warren-misogynstic-trope-democratic-debate-bloomberg-attack-a9348796.html,aoc defends elizabeth warren against misogynistic trope after democratic debate it s such gaslighting nonsense,[],"['aoc', 'defends', 'elizabeth', 'warren', 'misogynistic', 'trope', 'democratic', 'debate', 'gaslighting', 'nonsense']",0.0,2020-02-21 15:32:43
The White House Is Gaslighting Americans About Donald Trump’s Tariffs,,1740395050.0,792,41,https://www.newyorker.com/news/the-financial-page/the-white-house-is-gaslighting-americans-about-donald-trumps-tariffs,the white house is gaslighting americans about donald trump s tariffs,[],"['white', 'house', 'gaslighting', 'americans', 'donald', 'trump', 'tariffs']",0.0,2025-02-24 11:04:10
"AOC: Trump's Tariffs on Colombia Would Hurt Working People | 
""Trump is about to make every American pay even more for coffee,"" wrote Democratic Representative Alexandria Ocasio-Cortez of New York. ""Trump is all about making inflation worse for working class Americans.""",,1737938239.0,9367,547,https://www.commondreams.org/news/colombia-trump-tariffs,aoc trump s tariffs on colombia would hurt working people trump is about to make every american pay even more for coffee wrote democratic representative alexandria ocasio cortez of new york trump is all about making inflation worse for working class americans,[],"['aoc', 'trump', 'tariffs', 'colombia', 'would', 'hurt', 'working', 'people', 'trump', 'make', 'every', 'american', 'pay', 'even', 'coffee', 'wrote', 'democratic', 'representative', 'alexandria', 'ocasio', 'cortez', 'new', 'york', 'trump', 'making', 'inflation', 'worse', 'working', 'class', 'americans']",0.05909090909090908,2025-01-27 00:37:19
Donald Trump Gaslights Reporters Telling Them His Anti-Semitic Comments are All 'In Your Head',,1566415903.0,2200,107,https://www.newsweek.com/donald-trump-israel-jewish-anti-semitism-chosen-one-1455568,donald trump gaslights reporters telling them his anti semitic comments are all in your head,[],"['donald', 'trump', 'gaslights', 'reporters', 'telling', 'anti', 'semitic', 'comments', 'head']",0.0,2019-08-21 19:31:43
"Trump Mocked After Claiming Magnets Don’t Work Underwater at Rally - 'All I know about magnets is this, give me a glass of water, let me drop it on the magnets, that’s the end of the magnets,' Trump declared",,1704637211.0,28579,2910,https://themessenger.com/politics/trump-mocked-after-claiming-magnets-dont-work-underwater-at-rally,trump mocked after claiming magnets don t work underwater at rally all i know about magnets is this give me a glass of water let me drop it on the magnets that s the end of the magnets trump declared,[],"['trump', 'mocked', 'claiming', 'magnets', 'work', 'underwater', 'rally', 'know', 'magnets', 'give', 'glass', 'water', 'let', 'drop', 'magnets', 'end', 'magnets', 'trump', 'declared']",0.0,2024-01-07 14:20:11
"Sarah Huckabee Sanders appoints man who had sex with a minor to top state post. She claims LGBTQ+ rights need to be restricted to ""protect kids,"" but she appointed a man who admitted to having sex with a minor to a high-level position.",,1707167432.0,33885,1785,https://www.lgbtqnation.com/2024/02/sarah-huckabee-sanders-appoints-man-who-had-sex-with-a-minor-to-top-state-post/,sarah huckabee sanders appoints man who had sex with a minor to top state post she claims lgbtq rights need to be restricted to protect kids but she appointed a man who admitted to having sex with a minor to a high level position,[],"['sarah', 'huckabee', 'sanders', 'appoints', 'man', 'sex', 'minor', 'top', 'state', 'post', 'claims', 'lgbtq', 'rights', 'need', 'restricted', 'protect', 'kids', 'appointed', 'man', 'admitted', 'sex', 'minor', 'high', 'level', 'position']",0.14,2024-02-05 21:10:32
Trump says supporters ‘did sign up for’ higher costs,,1746013422.0,5293,463,https://www.today.com/video/trump-responds-to-supporters-worried-about-higher-prices-238609477582,trump says supporters did sign up for higher costs,[],"['trump', 'says', 'supporters', 'sign', 'higher', 'costs']",0.25,2025-04-30 11:43:42
Trump makes brazen attempt to gaslight the public about why he fired James Comey,,1527775268.0,3322,86,https://thinkprogress.org/trump-gaslight-public-about-why-he-fired-james-comey-f3737f4fe9d9/,trump makes brazen attempt to gaslight the public about why he fired james comey,[],"['trump', 'makes', 'brazen', 'attempt', 'gaslight', 'public', 'fired', 'james', 'comey']",0.0,2018-05-31 14:01:08
MAGA Melts Down Over Mike Pence’s Very Normal Announcement on Biden,,1721711535.0,12028,1028,https://newrepublic.com/post/184109/maga-meltdown-mike-pence-announcement-biden,maga melts down over mike pence s very normal announcement on biden,[],"['maga', 'melts', 'mike', 'pence', 'normal', 'announcement', 'biden']",0.019722222222222224,2024-07-23 05:12:15
"Trump Goes Full Deranged, Suggests Charging People He Doesn’t Like With Treason: This is not a joke. Donald Trump is stating very plainly what he would do if reelected.",,1695662374.0,41802,3742,https://newrepublic.com/post/175737/trump-deranged-milley-media-treason,trump goes full deranged suggests charging people he doesn t like with treason this is not a joke donald trump is stating very plainly what he would do if reelected,[],"['trump', 'goes', 'full', 'deranged', 'suggests', 'charging', 'people', 'like', 'treason', 'joke', 'donald', 'trump', 'stating', 'plainly', 'would', 'reelected']",0.0357142857142857,2023-09-25 17:19:34
"Trump Received Millions From Foreign Governments as President, Report Finds",,1704380767.0,29293,1821,https://www.nytimes.com/2024/01/04/us/politics/trump-hotels-foreign-business-report.html,trump received millions from foreign governments as president report finds,[],"['trump', 'received', 'millions', 'foreign', 'governments', 'president', 'report', 'finds']",-0.125,2024-01-04 15:06:07
"'Luv ya': Disgraced Baylor president, Clinton prosecutor Ken Starr emailed Jeffrey Epstein for years",,1763064329.0,4421,165,https://www.chron.com/culture/article/ken-starr-jeffrey-epstein-emails-21171020.php,luv ya disgraced baylor president clinton prosecutor ken starr emailed jeffrey epstein for years,[],"['luv', 'disgraced', 'baylor', 'president', 'clinton', 'prosecutor', 'ken', 'starr', 'emailed', 'jeffrey', 'epstein', 'years']",0.0,2025-11-13 20:05:29
Attorney General Letitia James Issues Statement on Donald Trump’s Weaponization of the Department of Justice,,1760047233.0,5292,176,https://ag.ny.gov/press-release/2025/attorney-general-letitia-james-issues-statement-donald-trumps-weaponization,attorney general letitia james issues statement on donald trump s weaponization of the department of justice,[],"['attorney', 'general', 'letitia', 'james', 'issues', 'statement', 'donald', 'trump', 'weaponization', 'department', 'justice']",0.05000000000000002,2025-10-09 22:00:33
"'Chill The F**k Out': John Fetterman Urges Democrats To Stick With Joe Biden | 
The Pennsylvania senator reminded panicked Democrats on Friday that he too had a bad debate once, yet he went on to win his Senate seat.",,1719590341.0,7948,1713,https://www.huffpost.com/entry/joe-biden-debate-john-fetterman_n_667ea850e4b0415858d6a2f1,chill the f k out john fetterman urges democrats to stick with joe biden the pennsylvania senator reminded panicked democrats on friday that he too had a bad debate once yet he went on to win his senate seat,[],"['chill', 'john', 'fetterman', 'urges', 'democrats', 'stick', 'joe', 'biden', 'pennsylvania', 'senator', 'reminded', 'panicked', 'democrats', 'friday', 'bad', 'debate', 'yet', 'went', 'win', 'senate', 'seat']",0.0500000000000001,2024-06-28 15:59:01
"Tulsi Gabbard reacts after Trump said she was ""wrong"" about Iran",,1750504131.0,3580,420,https://www.newsweek.com/tulsi-gabbard-reacts-after-trump-said-she-was-wrong-about-iran-2088685,tulsi gabbard reacts after trump said she was wrong about iran,[],"['tulsi', 'gabbard', 'reacts', 'trump', 'said', 'wrong', 'iran']",-0.5,2025-06-21 11:08:51
Joe Biden Calls Republicans Time-Wasting Liars After Impeachment Vote,,1702521277.0,22600,1800,https://www.huffpost.com/entry/joe-biden-statement-impeachment-republicans_n_657a45a6e4b020f3b673d42c,joe biden calls republicans time wasting liars after impeachment vote,[],"['joe', 'biden', 'calls', 'republicans', 'time', 'wasting', 'liars', 'impeachment', 'vote']",0.0,2023-12-14 02:34:37
Witness Told Feds She Was Paid for Sex Parties With Matt Gaetz,,1708078172.0,21102,1241,https://www.thedailybeast.com/witness-told-feds-she-was-paid-for-sex-parties-with-matt-gaetz?ref=wrap,witness told feds she was paid for sex parties with matt gaetz,[],"['witness', 'told', 'feds', 'paid', 'sex', 'parties', 'matt', 'gaetz']",0.0,2024-02-16 10:09:32
MAGA influencers are scrambling after the DOJ's Russia indictment,,1725937615.0,11872,624,https://www.msnbc.com/the-reidout/reidout-blog/tenet-media-russia-indictment-social-media-influencers-rcna170283,maga influencers are scrambling after the doj s russia indictment,[],"['maga', 'influencers', 'scrambling', 'doj', 'russia', 'indictment']",0.0,2024-09-10 03:06:55
MAGA Quickly Turns Biden’s Cancer Into Another Conspiracy,,1747621605.0,4193,406,https://www.thedailybeast.com/maga-immediately-turns-bidens-cancer-into-another-conspiracy/,maga quickly turns biden s cancer into another conspiracy,[],"['maga', 'quickly', 'turns', 'biden', 'cancer', 'another', 'conspiracy']",0.3333333333333333,2025-05-19 02:26:45
Biden's performance has been exceptional where it matters: It's the economy,,1720791850.0,6457,1739,https://www.salon.com/2024/07/12/bidens-performance-has-been-exceptional-where-it-matters-its-the-economy/,biden s performance has been exceptional where it matters it s the economy,[],"['biden', 'performance', 'exceptional', 'matters', 'economy']",0.6666666666666666,2024-07-12 13:44:10
Why are Democrats tarred as elites when the world’s richest man funds Trump?,,1728671822.0,10737,558,https://www.theguardian.com/commentisfree/2024/oct/10/democrats-elites-trump-musk-republicans,why are democrats tarred as elites when the world s richest man funds trump,[],"['democrats', 'tarred', 'elites', 'world', 'richest', 'man', 'funds', 'trump']",0.0,2024-10-11 18:37:02
Trump deserves our sympathy. That doesn’t make him an acceptable candidate ,,1720987497.0,5967,1988,https://www.theguardian.com/commentisfree/article/2024/jul/14/trump-deserves-our-sympathy-that-doesnt-make-him-an-acceptable-candidate,trump deserves our sympathy that doesn t make him an acceptable candidate,[],"['trump', 'deserves', 'sympathy', 'make', 'acceptable', 'candidate']",0.0,2024-07-14 20:04:57
Mitch McConnell is gaslighting Democrats (again),,1588162942.0,2256,81,https://www.vox.com/science-and-health/2020/4/29/21237980/coronavirus-stimulus-mitch-mcconnell-democrats,mitch mcconnell is gaslighting democrats again,[],"['mitch', 'mcconnell', 'gaslighting', 'democrats']",0.0,2020-04-29 12:22:22
Obama urges public to call on representatives to vote against Trump megabill,,1751498109.0,8424,189,https://thehill.com/homenews/house/5382390-obama-urges-public-to-call-their-representative-to-vote-against-trump-megabill/,obama urges public to call on representatives to vote against trump megabill,[],"['obama', 'urges', 'public', 'call', 'representatives', 'vote', 'trump', 'megabill']",0.0,2025-07-02 23:15:09
Leaked Emails Reveal Just How Powerful the Anti-Trans Movement Has Become,,1681475602.0,35662,5793,https://www.vice.com/en/article/7kxv8a/lobbyist-anti-trans-leaked-emails,leaked emails reveal just how powerful the anti trans movement has become,[],"['leaked', 'emails', 'reveal', 'powerful', 'anti', 'trans', 'movement', 'become']",0.3,2023-04-14 12:33:22
"Opinion: If you voted for Trump, how can you claim to care about women?",,1732286413.0,3902,1205,https://www.sandiegouniontribune.com/2024/11/21/opinion-if-you-voted-for-trump-how-can-you-claim-to-care-about-women/,opinion if you voted for trump how can you claim to care about women,[],"['opinion', 'voted', 'trump', 'claim', 'care', 'women']",0.0,2024-11-22 14:40:13
The Right Is Using the Nashville Shooting to Declare War on Trans People,,1680102493.0,40302,5067,https://www.vice.com/en/article/5d9ppz/nashville-shooting-marjorie-taylor-greene-matt-walsh-anti-trans,the right is using the nashville shooting to declare war on trans people,[],"['right', 'using', 'nashville', 'shooting', 'declare', 'war', 'trans', 'people']",0.2857142857142857,2023-03-29 15:08:13
Biden dropping out is a fantasy. Democrats can win — if they fight.,,1719932299.0,5030,2152,https://www.bostonglobe.com/2024/07/01/opinion/biden-democrats-drop-out-race/?s_campaign=audience:reddit,biden dropping out is a fantasy democrats can win if they fight,[],"['biden', 'dropping', 'fantasy', 'democrats', 'win', 'fight']",0.8,2024-07-02 14:58:19
"Rick Scott issues travel advisory for ‘socialists,’ warning Florida is ‘openly hostile’ to them",,1684864435.0,29059,3141,https://thehill.com/homenews/senate/4017344-rick-scott-issues-travel-advisory-for-socialists-warning-florida-is-openly-hostile-to-them/,rick scott issues travel advisory for socialists warning florida is openly hostile to them,[],"['rick', 'scott', 'issues', 'travel', 'advisory', 'socialists', 'warning', 'florida', 'openly', 'hostile']",0.0,2023-05-23 17:53:55
Trump is plotting the biggest tax rise in global history,,1743517612.0,4347,419,https://www.telegraph.co.uk/us/comment/2025/03/31/trump-plotting-biggest-tax-rise-global-history/?ICID=continue_without_subscribing_reg_first,trump is plotting the biggest tax rise in global history,[],"['trump', 'plotting', 'biggest', 'tax', 'rise', 'global', 'history']",0.0,2025-04-01 14:26:52
Biden says he thinks he has authority to use 14th Amendment on debt ceiling,,1684667996.0,30508,2878,https://thehill.com/homenews/administration/4014068-biden-says-he-thinks-he-has-authority-to-use-14th-amendment-on-debt-ceiling/,biden says he thinks he has authority to use 14th amendment on debt ceiling,[],"['biden', 'says', 'thinks', 'authority', 'use', '14th', 'amendment', 'debt', 'ceiling']",0.0,2023-05-21 11:19:56
J.D. Vance Blames ‘Fake Polls’ for Harris’ Lead,,1723993142.0,6799,820,https://www.rollingstone.com/politics/politics-news/jd-vance-fake-polls-harris-lead-1235082483/,j d vance blames fake polls for harris lead,[],"['vance', 'blames', 'fake', 'polls', 'harris', 'lead']",-0.5,2024-08-18 14:59:02
Sinema leaving the Democratic Party and registering as an independent,,1670583691.0,46455,7401,https://www.cnn.com/2022/12/09/politics/kyrsten-sinema-leaves-democratic-party/index.html,sinema leaving the democratic party and registering as an independent,[],"['sinema', 'leaving', 'democratic', 'party', 'registering', 'independent']",0.0,2022-12-09 11:01:31
Joe Rogan slams Trump administration over Epstein investigation: 'Trying to gaslight',,1753836130.0,426,25,https://abcnews.go.com/Politics/gaslight-joe-rogan-slams-trump-administrations-handling-epstein/story?id=124175021,joe rogan slams trump administration over epstein investigation trying to gaslight,[],"['joe', 'rogan', 'slams', 'trump', 'administration', 'epstein', 'investigation', 'trying', 'gaslight']",0.0,2025-07-30 00:42:10
Kristi Noem Is Gunning for Biden’s Dog,,1714925806.0,8673,952,https://www.rollingstone.com/politics/politics-news/kristi-noem-gunning-bidens-dog-commander-1235015420/,kristi noem is gunning for biden s dog,[],"['kristi', 'noem', 'gunning', 'biden', 'dog']",0.0,2024-05-05 16:16:46
Donald Trump says liberals wanted him to overturn Roe v. Wade: ‘Everybody wanted this to be done!’,,1714727686.0,8080,1015,https://www.thepinknews.com/2024/05/03/donald-trump-roe-v-wade/,donald trump says liberals wanted him to overturn roe v wade everybody wanted this to be done,[],"['donald', 'trump', 'says', 'liberals', 'wanted', 'overturn', 'roe', 'wade', 'everybody', 'wanted', 'done']",0.0,2024-05-03 09:14:46
Kellyanne Conway Smoked For 'Gaslighting' Everyone With Brazen Marijuana Lie,,1664322460.0,823,108,https://www.huffpost.com/entry/kellyanne-conway-marijuana-lie_n_6332772fe4b028164521d3b8,kellyanne conway smoked for gaslighting everyone with brazen marijuana lie,[],"['kellyanne', 'conway', 'smoked', 'gaslighting', 'everyone', 'brazen', 'marijuana', 'lie']",0.0,2022-09-27 23:47:40
US Army rebukes Trump campaign for incident at Arlington National Cemetery ,,1724944773.0,9941,487,https://www.cnn.com/2024/08/29/politics/us-army-rebukes-trump-campaign-arlington-incident/index.html,us army rebukes trump campaign for incident at arlington national cemetery,[],"['army', 'rebukes', 'trump', 'campaign', 'incident', 'arlington', 'national', 'cemetery']",0.0,2024-08-29 15:19:33
"No, Biden Did Not Order the FBI to Assassinate Trump at Mar-a-Lago",,1716390747.0,8098,826,https://www.rollingstone.com/politics/politics-news/trump-claim-fbi-kill-mar-a-lago-raid-1235025530/,no biden did not order the fbi to assassinate trump at mar a lago,[],"['biden', 'order', 'fbi', 'assassinate', 'trump', 'mar', 'lago']",0.0,2024-05-22 15:12:27
Biden announces proposal to replace all lead water service lines in US within 10 years,,1702232529.0,18171,885,https://abcnews.go.com/Politics/biden-announces-proposal-replace-lead-service-lines-us/story?id=105266898,biden announces proposal to replace all lead water service lines in us within 10 years,[],"['biden', 'announces', 'proposal', 'replace', 'lead', 'water', 'service', 'lines', 'within', 'years']",0.0,2023-12-10 18:22:09
"If you care about your country and your rights, don't vote for any Republicans in 2022",,1663579562.0,58838,6118,https://www.usatoday.com/story/opinion/columnists/2022/09/18/dangerous-2022-elections-abortion-voting-democracy/10368442002/,if you care about your country and your rights don t vote for any republicans in 2022,[],"['care', 'country', 'rights', 'vote', 'republicans', '2022']",0.0,2022-09-19 09:26:02
"JD Vance called Tim Walz a 'San Francisco-style liberal.' Walz visited the city for the first time last month, while Vance lived there for years.",,1722979170.0,11251,468,https://www.businessinsider.com/jd-vance-tim-walz-vice-president-san-francisco-2024-8,jd vance called tim walz a san francisco style liberal walz visited the city for the first time last month while vance lived there for years,[],"['vance', 'called', 'tim', 'walz', 'san', 'francisco', 'style', 'liberal', 'walz', 'visited', 'city', 'first', 'time', 'last', 'month', 'vance', 'lived', 'years']",0.125,2024-08-06 21:19:30
"Rep. Gerry Connolly rages at Jim Jordan for ""gaslighting"" him after ""vote to overturn election""",,1614212673.0,2081,61,https://www.newsweek.com/rep-gerry-connolly-rages-jim-jordan-gaslighting-him-after-vote-overturn-election-1571879,rep gerry connolly rages at jim jordan for gaslighting him after vote to overturn election,[],"['rep', 'gerry', 'connolly', 'rages', 'jim', 'jordan', 'gaslighting', 'vote', 'overturn', 'election']",0.0,2021-02-25 00:24:33
"Conservatives, If You Want To Ban ""Woke"" Materials In Schools Shouldn't You At Least Read Them First?",,1685958913.0,21159,1605,https://www.theroot.com/conservatives-if-you-want-to-ban-woke-materials-in-s-1850504545,conservatives if you want to ban woke materials in schools shouldn t you at least read them first,[],"['conservatives', 'want', 'ban', 'woke', 'materials', 'schools', 'least', 'read', 'first']",-0.024999999999999994,2023-06-05 09:55:13
Tapper cuts off Haley for blaming Biden for House not having Speaker,,1697389077.0,14840,1034,https://thehill.com/homenews/campaign/4256995-tapper-shuts-down-haley-blaming-biden-for-house-not-having-speaker/,tapper cuts off haley for blaming biden for house not having speaker,[],"['tapper', 'cuts', 'haley', 'blaming', 'biden', 'house', 'speaker']",0.0,2023-10-15 16:57:57
GOP Lawmaker Who Ousted Liz Cheney Says It's 'Bizarre' How 'Obsessed' People Are with Government at Explosive Town Hall,,1742572477.0,4117,355,https://people.com/harriet-hageman-explosive-town-hall-doge-cuts-social-security-11700478,gop lawmaker who ousted liz cheney says it s bizarre how obsessed people are with government at explosive town hall,[],"['gop', 'lawmaker', 'ousted', 'liz', 'cheney', 'says', 'bizarre', 'obsessed', 'people', 'government', 'explosive', 'town', 'hall']",-0.04999999999999999,2025-03-21 15:54:37
"Petition to impeach Clarence Thomas passes 300,000 signatures",,1656348732.0,90057,4096,https://www.newsweek.com/clarence-thomas-impeach-petition-signature-abortion-rights-january-6-insurrection-1719467?utm_medium=Social&utm_source=Twitter#Echobox=1656344544,petition to impeach clarence thomas passes 300 000 signatures,[],"['petition', 'impeach', 'clarence', 'thomas', 'passes', '300', '000', 'signatures']",0.0,2022-06-27 16:52:12
"Dems including Ocasio-Cortez, Speier, Alma Adams arrested at abortion rights rally outside Capitol",,1658255448.0,55380,4369,https://thehill.com/homenews/house/3566006-dems-including-ocasio-cortez-speier-alma-adams-arrested-at-abortion-rights-rally-outside-capitol/,dems including ocasio cortez speier alma adams arrested at abortion rights rally outside capitol,[],"['dems', 'including', 'ocasio', 'cortez', 'speier', 'alma', 'adams', 'arrested', 'abortion', 'rights', 'rally', 'outside', 'capitol']",0.0,2022-07-19 18:30:48
"Trump cancels another event, this time with RFK Jr – hours after labeling Harris ‘lazy as hell’",,1729634651.0,8696,362,https://www.independent.co.uk/news/world/americas/us-politics/trump-cancels-rally-rfk-gabbard-b2633794.html,trump cancels another event this time with rfk jr hours after labeling harris lazy as hell,[],"['trump', 'cancels', 'another', 'event', 'time', 'rfk', 'hours', 'labeling', 'harris', 'lazy', 'hell']",-0.25,2024-10-22 22:04:11
Why is the media gaslighting everyone about Joe Biden?,,1568397239.0,574,252,https://theweek.com/articles/864766,why is the media gaslighting everyone about joe biden,[],"['media', 'gaslighting', 'everyone', 'joe', 'biden']",0.0,2019-09-13 17:53:59
"Trump, who was impeached for withholding nearly $400 million in military aid from Ukraine, said 'this deadly Ukraine situation would never have happened' if he were in office",,1645788662.0,113926,7882,https://www.businessinsider.com/trump-statement-ukraine-crisis-would-never-have-happened-if-president-2022-2,trump who was impeached for withholding nearly 400 million in military aid from ukraine said this deadly ukraine situation would never have happened if he were in office,[],"['trump', 'impeached', 'withholding', 'nearly', '400', 'million', 'military', 'aid', 'ukraine', 'said', 'deadly', 'ukraine', 'situation', 'would', 'never', 'happened', 'office']",-0.06666666666666667,2022-02-25 11:31:02
Ted Cruz Storms Out on British Interviewer When Asked Why School Shootings Only Happen in America,,1653572053.0,61937,4598,https://www.thedailybeast.com/ted-cruz-storms-out-of-british-interview-when-asked-about-gun-violence-after-texas-school-shooting?source=articles&via=rss,ted cruz storms out on british interviewer when asked why school shootings only happen in america,[],"['ted', 'cruz', 'storms', 'british', 'interviewer', 'asked', 'school', 'shootings', 'happen', 'america']",0.0,2022-05-26 13:34:13
Video resurfaces of Trump calling Democrats ‘fascists’ as Conservatives rage over Biden speech,,1662252793.0,50021,2596,https://www.independent.co.uk/news/world/americas/us-politics/trump-clip-democrats-fascists-b2159062.html,video resurfaces of trump calling democrats fascists as conservatives rage over biden speech,[],"['video', 'resurfaces', 'trump', 'calling', 'democrats', 'fascists', 'conservatives', 'rage', 'biden', 'speech']",0.0,2022-09-04 00:53:13
