title,selftext,created_utc,score,num_comments,url,combined,hashtags,clean_tokens,sentiment,date
In Charlie Kirk’s Name: Trump Officials Signal Move to Limit Free Speech,,1758194972.0,9344,595,https://www.ft.com/content/336c171c-f49e-41e5-81c1-9018a6949d2c,in charlie kirk s name trump officials signal move to limit free speech,[],"['charlie', 'kirk', 'name', 'trump', 'officials', 'signal', 'move', 'limit', 'free', 'speech']",0.4,2025-09-18 11:29:32
Billionaire Trump Tells Americans Their Money Worries Don’t Exist | The president told Fox News that polls showing financial anxiety of voters were “fake.”,,1762867295.0,8921,373,https://www.thedailybeast.com/billionaire-trump-tells-americans-their-money-worries-dont-exist/,billionaire trump tells americans their money worries don t exist the president told fox news that polls showing financial anxiety of voters were fake,[],"['billionaire', 'trump', 'tells', 'americans', 'money', 'worries', 'exist', 'president', 'told', 'fox', 'news', 'polls', 'showing', 'financial', 'anxiety', 'voters', 'fake']",-0.25,2025-11-11 13:21:35
This Wasn’t a Debate. This Was a National Gaslighting.,,1475673250.0,1946,504,http://www.slate.com/articles/news_and_politics/politics/2016/10/mike_pence_won_because_he_was_shameless_about_denying_reality.html,this wasn t a debate this was a national gaslighting,[],"['debate', 'national', 'gaslighting']",0.0,2016-10-05 13:14:10
Democrats don’t need a Joe Rogan — they need to start talking like people again,,1749945356.0,11718,1333,https://thehill.com/opinion/campaign/5344497-democrats-joe-rogan-conversation/,democrats don t need a joe rogan they need to start talking like people again,[],"['democrats', 'need', 'joe', 'rogan', 'need', 'start', 'talking', 'like', 'people']",0.0,2025-06-14 23:55:56
CNN airs brutal montage of Trump officials who were in Signal chat condemning Hillary Clinton’s email server,,1742896228.0,59712,1317,https://www.independent.co.uk/news/world/americas/us-politics/trump-signal-hillary-clinton-cnn-atlantic-b2721016.html,cnn airs brutal montage of trump officials who were in signal chat condemning hillary clinton s email server,[],"['cnn', 'airs', 'brutal', 'montage', 'trump', 'officials', 'signal', 'chat', 'condemning', 'hillary', 'clinton', 'email', 'server']",-0.875,2025-03-25 09:50:28
Republicans gaslight voters on their covid response and failed policies,,1678202302.0,2279,115,https://www.washingtonpost.com/opinions/2023/03/07/covid-response-maga/,republicans gaslight voters on their covid response and failed policies,[],"['republicans', 'gaslight', 'voters', 'covid', 'response', 'failed', 'policies']",-0.5,2023-03-07 15:18:22
‘Delusional Projectionism’: Lawyers Pan Bill Barr’s Fox News Interview as Partisan ‘Gaslighting’,,1597076729.0,5391,118,https://lawandcrime.com/high-profile/delusional-projectionism-lawyers-pan-bill-barrs-fox-news-interview-as-partisan-gaslighting/,delusional projectionism lawyers pan bill barr s fox news interview as partisan gaslighting,[],"['delusional', 'projectionism', 'lawyers', 'pan', 'bill', 'barr', 'fox', 'news', 'interview', 'partisan', 'gaslighting']",0.0,2020-08-10 16:25:29
Trump Orders US Military to Plan Invasion of Panama to Seize Canal: Report,,1741881644.0,17911,2782,https://www.commondreams.org/news/trump-panama-canal-invasion-plan,trump orders us military to plan invasion of panama to seize canal report,[],"['trump', 'orders', 'military', 'plan', 'invasion', 'panama', 'seize', 'canal', 'report']",-0.1,2025-03-13 16:00:44
"Kayleigh McEnany’s latest briefing is a case study in gaslighting, whataboutism and false claims",,1590532569.0,2827,174,https://www.washingtonpost.com/politics/2020/05/26/kayleigh-mcenanys-latest-briefing-is-case-study-gaslighting-whataboutism-false-claims/,kayleigh mcenany s latest briefing is a case study in gaslighting whataboutism and false claims,[],"['kayleigh', 'mcenany', 'latest', 'briefing', 'case', 'study', 'gaslighting', 'whataboutism', 'false', 'claims']",0.04999999999999996,2020-05-26 22:36:09
Trump's Attorney General Is Gaslighting Robert Mueller,,1559315657.0,3488,169,https://www.vanityfair.com/news/2019/05/william-barr-cbs-interview-gaslighting-robert-mueller,trump s attorney general is gaslighting robert mueller,[],"['trump', 'attorney', 'general', 'gaslighting', 'robert', 'mueller']",0.05000000000000002,2019-05-31 15:14:17
The Supreme Court Gaslights Its Way to the End of Roe,,1638584614.0,1503,227,https://www.nytimes.com/2021/12/03/opinion/abortion-supreme-court.html,the supreme court gaslights its way to the end of roe,[],"['supreme', 'court', 'gaslights', 'way', 'end', 'roe']",0.0,2021-12-04 02:23:34
Leavitt Says Epstein Files Aren’t Fake—Just the Ones About Trump,,1757453138.0,10693,417,https://newrepublic.com/post/200230/karoline-leavitt-epstein-files-hoax-trump,leavitt says epstein files aren t fake just the ones about trump,[],"['leavitt', 'says', 'epstein', 'files', 'fake', 'ones', 'trump']",-0.5,2025-09-09 21:25:38
Trump insists grocery prices are down. Do Americans buy it?,,1759635903.0,3480,1067,https://www.nj.com/politics/2025/10/trump-has-insisted-grocery-prices-are-down-do-americans-buy-it.html,trump insists grocery prices are down do americans buy it,[],"['trump', 'insists', 'grocery', 'prices', 'americans', 'buy']",-0.15555555555555556,2025-10-05 03:45:03
Karoline Leavitt Snaps When Asked About Trump Profiting Off Presidency. Donald Trump is using various schemes to line his pockets while in the White House.,,1746817177.0,25543,717,https://newrepublic.com/post/195088/karoline-leavitt-snaps-donald-trump-profiting-off-presidency,karoline leavitt snaps when asked about trump profiting off presidency donald trump is using various schemes to line his pockets while in the white house,[],"['karoline', 'leavitt', 'snaps', 'asked', 'trump', 'profiting', 'presidency', 'donald', 'trump', 'using', 'various', 'schemes', 'line', 'pockets', 'white', 'house']",0.0,2025-05-09 18:59:37
JD Vance’s debate performance was a masterclass on how to gaslight women,,1727918292.0,1225,75,https://www.msnbc.com/opinion/msnbc-opinion/jd-vance-vice-presidential-debate-fail-rcna173598,jd vance s debate performance was a masterclass on how to gaslight women,[],"['vance', 'debate', 'performance', 'masterclass', 'gaslight', 'women']",0.0,2024-10-03 01:18:12
JD Vance tries to downplay leak of disgusting Young Republican chats: For the vice president to suggest it’s “pearl clutching” to condemn those who were part of a racist group chat says a great deal about his judgment.,,1760538720.0,8501,338,https://www.msnbc.com/rachel-maddow-show/maddowblog/jd-vance-tries-downplay-leak-disgusting-young-republican-chats-rcna237752?icid=recommended,jd vance tries to downplay leak of disgusting young republican chats for the vice president to suggest it s pearl clutching to condemn those who were part of a racist group chat says a great deal about his judgment,[],"['vance', 'tries', 'downplay', 'leak', 'disgusting', 'young', 'republican', 'chats', 'vice', 'president', 'suggest', 'pearl', 'clutching', 'condemn', 'part', 'racist', 'group', 'chat', 'says', 'great', 'deal', 'judgment']",-0.04999999999999999,2025-10-15 14:32:00
"Trump Claims He 'Never Went' To Epstein's Island, Tells People To Focus On Bill Clinton Instead | “You’re making a very big thing over something that’s not a big thing,” President Donald Trump told reporters questioning him about Jeffrey Epstein.",,1753561083.0,8476,626,https://www.huffpost.com/entry/trump-epstein-island-focus-clinton_n_68850023e4b07c2af0282e52,trump claims he never went to epstein s island tells people to focus on bill clinton instead you re making a very big thing over something that s not a big thing president donald trump told reporters questioning him about jeffrey epstein,[],"['trump', 'claims', 'never', 'went', 'epstein', 'island', 'tells', 'people', 'focus', 'bill', 'clinton', 'instead', 'making', 'big', 'thing', 'something', 'big', 'thing', 'president', 'donald', 'trump', 'told', 'reporters', 'questioning', 'jeffrey', 'epstein']",0.0,2025-07-26 20:18:03
Donald Trump is a classic gaslighter in an abusive relationship with America,,1538557420.0,4191,134,https://www.usatoday.com/story/opinion/2018/10/03/trump-classic-gaslighter-abusive-relationship-america-column/1445050002/,donald trump is a classic gaslighter in an abusive relationship with america,[],"['donald', 'trump', 'classic', 'gaslighter', 'abusive', 'relationship', 'america']",0.16666666666666666,2018-10-03 09:03:40
Trump gaslights the American public about North Korea’s nuclear weapons,,1528896192.0,3328,159,https://thinkprogress.org/trump-north-korea-nuclear-weapons-gaslighting-kim-jong-un-54b484337e58/,trump gaslights the american public about north korea s nuclear weapons,[],"['trump', 'gaslights', 'american', 'public', 'north', 'korea', 'nuclear', 'weapons']",0.0,2018-06-13 13:23:12
'Got To Be Kidding Me!' Capitol Police Officer Rips GOP Gaslighting On Insurrection,,1621007544.0,3783,93,https://www.huffpost.com/entry/capitol-police-officer-insurrection-gop-spin_n_609e57fde4b063dccea89ade,got to be kidding me capitol police officer rips gop gaslighting on insurrection,[],"['got', 'kidding', 'capitol', 'police', 'officer', 'rips', 'gop', 'gaslighting', 'insurrection']",0.0,2021-05-14 15:52:24
"""Peak gaslighting"": Legal scholars shred Supreme Court's spin on new ""unenforceable"" ethics code",,1699984408.0,2778,53,https://www.salon.com/2023/11/14/peak-gaslighting-legal-scholars-shred-spin-on-new-unenforceable-ethics-code/,peak gaslighting legal scholars shred supreme court s spin on new unenforceable ethics code,[],"['peak', 'gaslighting', 'legal', 'scholars', 'shred', 'supreme', 'court', 'spin', 'new', 'unenforceable', 'ethics', 'code']",0.16818181818181818,2023-11-14 17:53:28
How Trump Plans to Manipulate US Economic Data to Gaslight the Public,,1742089452.0,567,86,https://www.thenation.com/article/economy/trump-manipulate-economic-data-fesac/,how trump plans to manipulate us economic data to gaslight the public,[],"['trump', 'plans', 'manipulate', 'economic', 'data', 'gaslight', 'public']",0.1,2025-03-16 01:44:12
Bessent calls anti-tariff Reagan ad 'psy-ops' and says the U.S. rescue of Argentina still counts as 'America first' because it helps an ally | Fortune,,1761521988.0,3520,476,https://fortune.com/2025/10/26/bessent-reagan-anti-tariff-tv-ad-psyops-argentina-rescue-america-first/,bessent calls anti tariff reagan ad psy ops and says the u s rescue of argentina still counts as america first because it helps an ally fortune,[],"['bessent', 'calls', 'anti', 'tariff', 'reagan', 'psy', 'ops', 'says', 'rescue', 'argentina', 'still', 'counts', 'america', 'first', 'helps', 'ally', 'fortune']",0.25,2025-10-26 23:39:48
Sean Spicer is still trying to gaslight America about President Trump,,1532357472.0,3368,140,https://www.washingtonpost.com/outlook/sean-spicer-is-still-trying-to-gaslight-america-about-president-trump/2018/07/22/dc239f2a-8dfa-11e8-bcd5-9d911c784c38_story.html?utm_term=.74fe4d707324,sean spicer is still trying to gaslight america about president trump,[],"['sean', 'spicer', 'still', 'trying', 'gaslight', 'america', 'president', 'trump']",0.0,2018-07-23 14:51:12
Liz Cheney Responds to Donald Trump Saying Guns Should Be Fired at Her,,1730462928.0,22938,2054,https://www.newsweek.com/cheney-trump-guns-face-dictator-responds-1978492,liz cheney responds to donald trump saying guns should be fired at her,[],"['liz', 'cheney', 'responds', 'donald', 'trump', 'saying', 'guns', 'fired']",0.0,2024-11-01 12:08:48
Al Gore blasts Trump: 'You can't gaslight a virus',,1585659550.0,4397,96,https://thehill.com/homenews/administration/490317-al-gore-blasts-trump-you-cant-gaslight-a-virus,al gore blasts trump you can t gaslight a virus,[],"['gore', 'blasts', 'trump', 'gaslight', 'virus']",0.0,2020-03-31 12:59:10
"Trump’s latest morning of tweets was off the rails, even by his standards: Insults, lies, gaslighting, authoritarian threats — all before the coffee even hit.",,1562857354.0,1562,248,https://www.vox.com/2019/7/11/20690150/trump-tweets-off-the-rails-july-11-2019,trump s latest morning of tweets was off the rails even by his standards insults lies gaslighting authoritarian threats all before the coffee even hit,[],"['trump', 'latest', 'morning', 'tweets', 'rails', 'even', 'standards', 'insults', 'lies', 'gaslighting', 'authoritarian', 'threats', 'coffee', 'even', 'hit']",0.5,2019-07-11 15:02:34
JD Vance turned in a debate performance that was a true master class — in gaslighting,,1727957077.0,1223,59,https://www.latimes.com/opinion/story/2024-10-02/vice-presidential-debate-jd-vance-tim-walz-election-2024-robin-abcarian,jd vance turned in a debate performance that was a true master class in gaslighting,[],"['vance', 'turned', 'debate', 'performance', 'true', 'master', 'class', 'gaslighting']",0.35,2024-10-03 12:04:37
"After the Mueller gaslighting, we know the adults won't save us. But the kids might",,1553856522.0,2377,169,https://www.salon.com/2019/03/29/after-the-mueller-gaslighting-we-know-the-adults-wont-save-us-but-the-kids-might/,after the mueller gaslighting we know the adults won t save us but the kids might,[],"['mueller', 'gaslighting', 'know', 'adults', 'save', 'kids', 'might']",0.0,2019-03-29 10:48:42
John Roberts Warns Trump After His Call to Impeach Judges: The Supreme Court’s chief justice issued a rare public statement.,,1742318236.0,14059,693,https://newrepublic.com/post/192876/john-roberts-warns-trump-impeach-judges,john roberts warns trump after his call to impeach judges the supreme court s chief justice issued a rare public statement,[],"['john', 'roberts', 'warns', 'trump', 'call', 'impeach', 'judges', 'supreme', 'court', 'chief', 'justice', 'issued', 'rare', 'public', 'statement']",0.15,2025-03-18 17:17:16
Trump Press Sec Snaps at Media as Queries about His Mental State Grow,,1752832755.0,7819,426,https://newrepublic.com/article/198096/trump-press-sec-snaps-media-queries-mental-state-grow,trump press sec snaps at media as queries about his mental state grow,[],"['trump', 'press', 'sec', 'snaps', 'media', 'queries', 'mental', 'state', 'grow']",-0.1,2025-07-18 09:59:15
Kamala Harris’ campaign didn’t ignore working class voters,,1731103003.0,9884,4442,https://www.msnbc.com/opinion/msnbc-opinion/biden-harris-working-class-vote-trump-election-rcna179186,kamala harris campaign didn t ignore working class voters,[],"['kamala', 'harris', 'campaign', 'ignore', 'working', 'class', 'voters']",0.0,2024-11-08 21:56:43
Jim Acosta Says Trump ‘Freaking Out’ Over Epstein Blowback,,1752447198.0,9147,386,https://www.thedailybeast.com/former-cnn-white-house-correspondent-jim-acosta-says-trump-freaking-out-over-epstein-blowback/,jim acosta says trump freaking out over epstein blowback,[],"['jim', 'acosta', 'says', 'trump', 'freaking', 'epstein', 'blowback']",0.0,2025-07-13 22:53:18
"Trump is trying to do to Anthony Fauci what the right did to Al Gore — but it's not working. Gaslighting folks on climate change was easy, because it's slow-moving — but the coronavirus is here and now",,1594750126.0,5296,76,https://www.salon.com/2020/07/14/trump-is-trying-to-do-to-anthony-fauci-what-the-right-did-to-al-gore--but-its-not-working/,trump is trying to do to anthony fauci what the right did to al gore but it s not working gaslighting folks on climate change was easy because it s slow moving but the coronavirus is here and now,[],"['trump', 'trying', 'anthony', 'fauci', 'right', 'gore', 'working', 'gaslighting', 'folks', 'climate', 'change', 'easy', 'slow', 'moving', 'coronavirus']",0.13968253968253966,2020-07-14 18:08:46
Jake Tapper: Trump is trying to ‘gaslight the country’,,1574471712.0,2936,120,https://www.politico.com/news/2019/11/22/jake-tapper-trump-gaslight-country-072888,jake tapper trump is trying to gaslight the country,[],"['jake', 'tapper', 'trump', 'trying', 'gaslight', 'country']",0.0,2019-11-23 01:15:12
"George Conway: McConnell is ""gaslighting"" America by blaming Trump's virus ""failures"" on impeachment",,1585770590.0,3502,100,https://www.salon.com/2020/04/01/george-conway-mcconnell-is-gaslighting-america-by-blaming-trumps-virus-failures-on-impeachment/,george conway mcconnell is gaslighting america by blaming trump s virus failures on impeachment,[],"['george', 'conway', 'mcconnell', 'gaslighting', 'america', 'blaming', 'trump', 'virus', 'failures', 'impeachment']",0.0,2020-04-01 19:49:50
Elon Says He’s ‘Never Done Anything Harmful.’ Americans Disagree,,1742394531.0,9744,747,https://www.rollingstone.com/politics/politics-news/elon-musk-claims-never-done-harmful-fox-interview-1235299267/,elon says he s never done anything harmful americans disagree,[],"['elon', 'says', 'never', 'done', 'anything', 'harmful', 'americans', 'disagree']",0.0,2025-03-19 14:28:51
Donald Trump’s voter fraud investigation isn’t about uncovering voter fraud. It’s about gaslighting.,,1485369812.0,3118,144,https://newrepublic.com/minutes/140093/donald-trumps-voter-fraud-investigation-isnt-uncovering-voter-fraud-its-gaslighting,donald trump s voter fraud investigation isn t about uncovering voter fraud it s about gaslighting,[],"['donald', 'trump', 'voter', 'fraud', 'investigation', 'uncovering', 'voter', 'fraud', 'gaslighting']",0.0,2017-01-25 18:43:32
"Pam Bondi Pledging to 'Come After' Those Who Go Against Trump Policies, Including Judges, Sparks Fears of 'End Times': 'This is a Test'",,1745618697.0,9211,579,https://www.latintimes.com/pam-bondi-pledging-come-after-those-who-go-against-trump-policies-including-judges-sparks-581757,pam bondi pledging to come after those who go against trump policies including judges sparks fears of end times this is a test,[],"['pam', 'bondi', 'pledging', 'come', 'trump', 'policies', 'including', 'judges', 'sparks', 'fears', 'end', 'times', 'test']",0.0,2025-04-25 22:04:57
JD Vance Ridiculed For Defending Confederate Soldiers: 'Weird Stance For The Vice President',,1749850813.0,9780,413,https://www.latintimes.com/jd-vance-ridiculed-defending-confederate-soldiers-weird-stance-vice-president-585010,jd vance ridiculed for defending confederate soldiers weird stance for the vice president,[],"['vance', 'ridiculed', 'defending', 'confederate', 'soldiers', 'weird', 'stance', 'vice', 'president']",-0.5,2025-06-13 21:40:13
Trump reacts to new Atlantic messages: ‘Really not a big deal’,,1743001362.0,6876,955,https://thehill.com/homenews/administration/5214890-trump-atlantic-signal-chat-response/amp/,trump reacts to new atlantic messages really not a big deal,[],"['trump', 'reacts', 'new', 'atlantic', 'messages', 'really', 'big', 'deal']",0.06818181818181818,2025-03-26 15:02:42
White Nationalist Does Massacre. Now the Gaslighting Begins.,,1565020569.0,2136,155,https://prospect.org/article/white-nationalist-does-massacre-now-gaslighting-begins,white nationalist does massacre now the gaslighting begins,[],"['white', 'nationalist', 'massacre', 'gaslighting', 'begins']",0.0,2019-08-05 15:56:09
Tim Walz: It’s ‘hard’ to understand why voters ‘wound up choosing the other path’,,1731170065.0,11146,1972,https://www.washingtonexaminer.com/news/campaigns/presidential/3224483/tim-walz-concession-speech-hard-to-understand-loss/,tim walz it s hard to understand why voters wound up choosing the other path,[],"['tim', 'walz', 'hard', 'understand', 'voters', 'wound', 'choosing', 'path']",-0.20833333333333334,2024-11-09 16:34:25
"Alyssa Farah Griffin: RFK Jr. Isn’t Just an Anti-Vaxxer, He’s a Gaslighting Fraud",,1712245487.0,1220,71,https://www.thedailybeast.com/alyssa-farah-griffin-rfk-jr-isnt-just-an-anti-vaxxer-hes-a-gaslighting-fraud,alyssa farah griffin rfk jr isn t just an anti vaxxer he s a gaslighting fraud,[],"['alyssa', 'farah', 'griffin', 'rfk', 'anti', 'vaxxer', 'gaslighting', 'fraud']",0.0,2024-04-04 15:44:47
"How to understand Trump now: Wounded child, drug addict or delusional gaslighter?",,1577106549.0,2178,140,https://www.salon.com/2019/12/23/how-to-understand-trump-now-wounded-child-drug-addict-or-delusional-gaslighter/,how to understand trump now wounded child drug addict or delusional gaslighter,[],"['understand', 'trump', 'wounded', 'child', 'drug', 'addict', 'delusional', 'gaslighter']",0.0,2019-12-23 13:09:09
MAGA loyalist dishes out advice for Trump Republicans: Don’t ‘gaslight’ Americans on prices!,,1763083209.0,359,35,https://www.nj.com/politics/2025/11/maga-loyalist-dishes-out-advice-for-trump-republicans-dont-gaslight-americans-on-prices.html,maga loyalist dishes out advice for trump republicans don t gaslight americans on prices,[],"['maga', 'loyalist', 'dishes', 'advice', 'trump', 'republicans', 'gaslight', 'americans', 'prices']",0.0,2025-11-14 01:20:09
"Letter: If Biden's age was so concerning, why isn't Trump's age?",,1722942466.0,22139,1999,https://www.stltoday.com/opinion/letters/letter-if-bidens-age-was-so-concerning-why-isnt-trumps-age/article_dc029b90-537e-11ef-9339-4bd759e7ba68.html,letter if biden s age was so concerning why isn t trump s age,[],"['letter', 'biden', 'age', 'concerning', 'trump', 'age']",0.0,2024-08-06 11:07:46
GOP support erodes for Epstein files petition,,1757079722.0,6270,294,https://www.axios.com/2025/09/04/massies-epstein-discharge-petition-trump,gop support erodes for epstein files petition,[],"['gop', 'support', 'erodes', 'epstein', 'files', 'petition']",0.0,2025-09-05 13:42:02
Project 2025 was supposed to boost Donald Trump's campaign — but it may be backfiring instead:,,1720174499.0,24870,2332,https://www.salon.com/2024/07/05/project-2025-was-supposed-to-boost-donald-campaign--but-it-may-be-backfiring-instead/,project 2025 was supposed to boost donald trump s campaign but it may be backfiring instead,[],"['project', '2025', 'supposed', 'boost', 'donald', 'trump', 'campaign', 'may', 'backfiring', 'instead']",0.0,2024-07-05 10:14:59
“Red Wave” Redux: Are GOP Polls Rigging the Averages in Trump’s Favor?,,1729682077.0,11002,1727,https://newrepublic.com/article/187425/gop-polls-rigging-averages-trump,red wave redux are gop polls rigging the averages in trump s favor,[],"['red', 'wave', 'redux', 'gop', 'polls', 'rigging', 'averages', 'trump', 'favor']",0.0,2024-10-23 11:14:37
Trump Denies Ever Saying ‘Lock Her Up.’ He Did… Several Times,,1717341625.0,34023,2090,https://www.rollingstone.com/politics/politics-news/trump-denies-saying-lock-her-up-clinton-1235031145/,trump denies ever saying lock her up he did several times,[],"['trump', 'denies', 'ever', 'saying', 'lock', 'several', 'times']",0.0,2024-06-02 15:20:25
Donald Trump’s Defense of Michael Flynn and Roger Stone Is a Giant Gaslight,,1588414706.0,2923,96,https://www.motherjones.com/politics/2020/05/donald-trumps-defense-of-michael-flynn-and-roger-stone-is-a-giant-gaslight/,donald trump s defense of michael flynn and roger stone is a giant gaslight,[],"['donald', 'trump', 'defense', 'michael', 'flynn', 'roger', 'stone', 'giant', 'gaslight']",0.0,2020-05-02 10:18:26
We published real photos of troops sleeping on a floor in L.A. Right-wing critics called them fake,,1749627010.0,9482,340,https://www.sfchronicle.com/california/article/national-guard-photos-20370678.php,we published real photos of troops sleeping on a floor in l a right wing critics called them fake,[],"['published', 'real', 'photos', 'troops', 'sleeping', 'floor', 'right', 'wing', 'critics', 'called', 'fake']",-0.004761904761904763,2025-06-11 07:30:10
Greene says Trump administration ‘infuriating people’ by ‘gaslighting’ them on affordability,,1763148224.0,373,30,https://thehill.com/homenews/house/5606339-trump-greene-affordability/,greene says trump administration infuriating people by gaslighting them on affordability,[],"['greene', 'says', 'trump', 'administration', 'infuriating', 'people', 'gaslighting', 'affordability']",-0.6,2025-11-14 19:23:44
Elon Musk called a combat veteran a 'traitor.' No American should tolerate it.,,1741973370.0,18841,390,https://eu.usatoday.com/story/opinion/columnist/2025/03/13/musk-calls-mark-kelly-traitor-ukraine/82313812007/,elon musk called a combat veteran a traitor no american should tolerate it,[],"['elon', 'musk', 'called', 'combat', 'veteran', 'traitor', 'american', 'tolerate']",0.0,2025-03-14 17:29:30
Is Donald Trump delusional or a gaslighter? Media should say clearly: It's both,,1584614208.0,3929,76,https://www.salon.com/2020/03/19/is-donald-trump-delusional-or-a-gaslighter-media-should-say-clearly-its-both/,is donald trump delusional or a gaslighter media should say clearly it s both,[],"['donald', 'trump', 'delusional', 'gaslighter', 'media', 'say', 'clearly']",0.09999999999999999,2020-03-19 10:36:48
Hillary Clinton warns Trump ‘stupidity’ will leave US ‘feeble and friendless’,,1743171684.0,8528,514,https://www.theguardian.com/us-news/2025/mar/28/hillary-clinton-trump-stupidity,hillary clinton warns trump stupidity will leave us feeble and friendless,[],"['hillary', 'clinton', 'warns', 'trump', 'stupidity', 'leave', 'feeble', 'friendless']",-0.55,2025-03-28 14:21:24
The House will have its first openly trans member next year. The GOP is already attacking her.,,1732189916.0,10441,975,https://www.vox.com/politics/386777/mike-johnson-bathroom-nancy-mace-sarah-mcbride,the house will have its first openly trans member next year the gop is already attacking her,[],"['house', 'first', 'openly', 'trans', 'member', 'next', 'year', 'gop', 'already', 'attacking']",0.08333333333333333,2024-11-21 11:51:56
