title,selftext,created_utc,score,num_comments,url,combined,hashtags,clean_tokens,sentiment,date
Jake Tapper says Trump is gaslighting the public on Epstein: ‘You’re being played for fools’,,1752084897.0,6532,329,https://www.independent.co.uk/news/world/americas/us-politics/jake-tapper-trump-epstein-list-gaslighting-b2785737.html,jake tapper says trump is gaslighting the public on epstein you re being played for fools,[],"['jake', 'tapper', 'says', 'trump', 'gaslighting', 'public', 'epstein', 'played', 'fools']",0.0,2025-07-09 18:14:57
"Why Karoline Leavitt is so annoying. From trolling the media to gaslighting the public, it's clear why Trump hired her as press secretary.",,1750726904.0,4800,467,https://www.salon.com/2025/06/23/why-karoline-leavitt-is-so-annoying/,why karoline leavitt is so annoying from trolling the media to gaslighting the public it s clear why trump hired her as press secretary,[],"['karoline', 'leavitt', 'annoying', 'trolling', 'media', 'gaslighting', 'public', 'clear', 'trump', 'hired', 'press', 'secretary']",-0.23333333333333336,2025-06-24 01:01:44
"Leftists, don't gaslight yourselves: It's time to unite against the fascist Republicans",,1666695425.0,18845,2043,https://www.salon.com/2022/10/25/norman-say-no-to-fascism/,leftists don t gaslight yourselves it s time to unite against the fascist republicans,[],"['leftists', 'gaslight', 'time', 'unite', 'fascist', 'republicans']",0.0,2022-10-25 10:57:05
"We are guilty. Period.’: Jan. 6 rioter refuses pardon from ‘felon Trump,’ claims president has been ‘gaslighting’ followers",,1748913515.0,6751,157,https://lawandcrime.com/high-profile/we-are-guilty-period-jan-6-rioter-refuses-pardon-from-felon-trump-claims-president-has-been-gaslighting-followers,we are guilty period jan 6 rioter refuses pardon from felon trump claims president has been gaslighting followers,[],"['guilty', 'period', 'jan', 'rioter', 'refuses', 'pardon', 'felon', 'trump', 'claims', 'president', 'gaslighting', 'followers']",-0.5,2025-06-03 01:18:35
Opinion: Republicans want to gaslight you into thinking they’re looking out for you,,1646481822.0,27890,2051,https://www.washingtonpost.com/opinions/2022/03/04/kim-reynolds-sotu-response-gaslight/,opinion republicans want to gaslight you into thinking they re looking out for you,[],"['opinion', 'republicans', 'want', 'gaslight', 'thinking', 'looking']",0.0,2022-03-05 12:03:42
Republicans Are Gaslighting The Country About The Capitol Riot,,1615038120.0,38193,2067,https://m.huffpost.com/us/entry/us_60428828c5b613cec15d8b73,republicans are gaslighting the country about the capitol riot,[],"['republicans', 'gaslighting', 'country', 'capitol', 'riot']",0.0,2021-03-06 13:42:00
DOJ Releases Graphic New Video While Republicans Try to Gaslight America About the Insurrection,,1624040565.0,21230,1771,https://www.rollingstone.com/politics/politics-news/doj-new-graphic-insurrection-video-1186360/,doj releases graphic new video while republicans try to gaslight america about the insurrection,[],"['doj', 'releases', 'graphic', 'new', 'video', 'republicans', 'try', 'gaslight', 'america', 'insurrection']",0.06818181818181818,2021-06-18 18:22:45
"Mary Trump said she thinks her uncle genuinely believes he won the election, and that he's the only person she knows 'who can gaslight himself'",,1606995569.0,29692,1287,https://www.businessinsider.com/mary-trump-president-gaslighting-himself-thinks-he-won-election-2020-12,mary trump said she thinks her uncle genuinely believes he won the election and that he s the only person she knows who can gaslight himself,[],"['mary', 'trump', 'said', 'thinks', 'uncle', 'genuinely', 'believes', 'election', 'person', 'knows', 'gaslight']",0.2,2020-12-03 11:39:29
Twitter Explodes After ‘Gaslighter’ Sarah Sanders Accuses CNN Of Dividing America,,1540459681.0,29588,3383,https://www.huffingtonpost.com/entry/sarah-huckabee-sanders-cnn-divide-reaction_us_5bd161b7e4b055bc94884f99,twitter explodes after gaslighter sarah sanders accuses cnn of dividing america,[],"['twitter', 'explodes', 'gaslighter', 'sarah', 'sanders', 'accuses', 'cnn', 'dividing', 'america']",0.0,2018-10-25 09:28:01
"‘Gaslighting 101’: Ted Cruz ridiculed over claim GOP has never tried to pack the Supreme Court | ‘You didn’t see us try to pack the court,’ Texas senator says",,1619179100.0,15305,1076,https://www.independent.co.uk/news/world/americas/us-politics/tez-cruz-packing-supreme-court-b1836242.html,gaslighting 101 ted cruz ridiculed over claim gop has never tried to pack the supreme court you didn t see us try to pack the court texas senator says,[],"['gaslighting', '101', 'ted', 'cruz', 'ridiculed', 'claim', 'gop', 'never', 'tried', 'pack', 'supreme', 'court', 'see', 'try', 'pack', 'court', 'texas', 'senator', 'says']",0.0,2021-04-23 11:58:20
Republicans and Democrats Say Their Criticism of Ilhan Omar Is About Anti-Semitism. They’re Gaslighting You.,,1551805531.0,17102,3285,https://theintercept.com/2019/03/05/republicans-and-democrats-say-their-criticism-of-ilhan-omar-is-about-anti-semitism-theyre-gaslighting-you/,republicans and democrats say their criticism of ilhan omar is about anti semitism they re gaslighting you,[],"['republicans', 'democrats', 'say', 'criticism', 'ilhan', 'omar', 'anti', 'semitism', 'gaslighting']",0.0,2019-03-05 17:05:31
Those who blame high gas prices on Joe Biden’s climate policies are gaslighting Americans,,1655924041.0,7386,647,https://www.bangordailynews.com/2022/06/22/opinion/opinion-contributor/those-who-blame-high-gas-prices-on-joe-bidens-climate-policies-are-gaslighting-americans/,those who blame high gas prices on joe biden s climate policies are gaslighting americans,[],"['blame', 'high', 'gas', 'prices', 'joe', 'biden', 'climate', 'policies', 'gaslighting', 'americans']",0.16,2022-06-22 18:54:01
"Republicans are gaslighting America about Trump's coup: Only impeachment can set the record straight. Impeachment establishes a formal record, making it harder for the right to pressure media to downplay January 6",,1610387758.0,32466,572,https://www.salon.com/2021/01/11/republicans-are-gaslighting-america-about-trumps-coup-onlyimpeachment-can-set-the-record-straight/,republicans are gaslighting america about trump s coup only impeachment can set the record straight impeachment establishes a formal record making it harder for the right to pressure media to downplay january 6,[],"['republicans', 'gaslighting', 'america', 'trump', 'coup', 'impeachment', 'set', 'record', 'straight', 'impeachment', 'establishes', 'formal', 'record', 'making', 'harder', 'right', 'pressure', 'media', 'downplay', 'january']",0.09642857142857142,2021-01-11 17:55:58
"Trump Is Gaslighting Himself and Really Thinks He Won the Election, Mary Trump Says — “I don’t think he’s ever accepted the truth of the loss. I don't think he’s psychologically or emotionally capable of that.”",,1606524357.0,15251,606,https://www.vice.com/en/article/jgq5bx/trump-is-gaslighting-himself-and-really-thinks-he-won-the-election-mary-trump-says,trump is gaslighting himself and really thinks he won the election mary trump says i don t think he s ever accepted the truth of the loss i don t think he s psychologically or emotionally capable of that,[],"['trump', 'gaslighting', 'really', 'thinks', 'election', 'mary', 'trump', 'says', 'think', 'ever', 'accepted', 'truth', 'loss', 'think', 'psychologically', 'emotionally', 'capable']",0.2,2020-11-28 00:45:57
"The GOP's gaslighting of AOC reveals a party unable to admit its own trauma | Trauma doesn’t have to be filmed to be believed. But in the case of the Capitol riots, we have the receipts.",,1612826790.0,14014,447,https://www.msnbc.com/opinion/gop-s-gaslighting-aoc-reveals-party-unable-admit-its-own-n1257032,the gop s gaslighting of aoc reveals a party unable to admit its own trauma trauma doesn t have to be filmed to be believed but in the case of the capitol riots we have the receipts,[],"['gop', 'gaslighting', 'aoc', 'reveals', 'party', 'unable', 'admit', 'trauma', 'trauma', 'filmed', 'believed', 'case', 'capitol', 'riots', 'receipts']",0.04999999999999999,2021-02-08 23:26:30
Trump Tried To 'Gaslight' About Coronavirus Again. Twitter Users Weren't Having It.,,1584619374.0,11777,509,https://www.huffpost.com/entry/donald-trump-coronavirus-snuck-up-on-us_n_5e731e27c5b6eab779424d52,trump tried to gaslight about coronavirus again twitter users weren t having it,[],"['trump', 'tried', 'gaslight', 'coronavirus', 'twitter', 'users']",0.0,2020-03-19 12:02:54
The Police Are Gaslighting Us,,1591384401.0,11842,439,https://www.vice.com/en_us/article/n7wnkz/the-police-are-gaslighting-us,the police are gaslighting us,[],"['police', 'gaslighting']",0.0,2020-06-05 19:13:21
"Yes, the White House is gaslighting America",,1498660148.0,9306,935,http://www.salon.com/2017/06/28/yes-the-white-house-is-gaslighting-america/,yes the white house is gaslighting america,[],"['yes', 'white', 'house', 'gaslighting', 'america']",0.0,2017-06-28 14:29:08
The GOP is gaslighting America,,1570442694.0,12285,471,https://theweek.com/articles/870020/gop-gaslighting-america,the gop is gaslighting america,[],"['gop', 'gaslighting', 'america']",0.0,2019-10-07 10:04:54
Al Gore Hammers Trump’s Coronavirus Lies: ‘You Can’t Gaslight A Virus’,,1585646752.0,11703,424,https://m.huffpost.com/us/entry/us_5e82e1a0c5b62dd9f5d4ed57,al gore hammers trump s coronavirus lies you can t gaslight a virus,[],"['gore', 'hammers', 'trump', 'coronavirus', 'lies', 'gaslight', 'virus']",0.0,2020-03-31 09:25:52
‘Written By Gaslight’: People Aren’t Buying McConnell’s Reasons For Acquitting Trump,,1613483505.0,13256,292,https://www.huffpost.com/entry/mitch-mcconnell-op-ed-criticism_n_602b9c7bc5b6d667582f4adf,written by gaslight people aren t buying mcconnell s reasons for acquitting trump,[],"['written', 'gaslight', 'people', 'buying', 'mcconnell', 'reasons', 'acquitting', 'trump']",0.0,2021-02-16 13:51:45
Alexandria Ocasio-Cortez slams Trump's attack on Iran as 'an act of war' that 'risks the lives of millions' and warns that war advocates are 'gaslighting' Americans,,1578089233.0,8347,457,https://www.businessinsider.com/aoc-condemns-trumps-iran-attack-and-pushes-for-congressional-action-2020-1,alexandria ocasio cortez slams trump s attack on iran as an act of war that risks the lives of millions and warns that war advocates are gaslighting americans,[],"['alexandria', 'ocasio', 'cortez', 'slams', 'trump', 'attack', 'iran', 'act', 'war', 'risks', 'lives', 'millions', 'warns', 'war', 'advocates', 'gaslighting', 'americans']",0.0,2020-01-03 22:07:13
Ivanka Accused Of 'Gaslighting Americans' With Claim Trump Is Helping Victims Of Human Trafficking,,1572433007.0,8024,476,https://www.newsweek.com/ivanka-trump-donald-trump-fighting-human-trafficking-1468619,ivanka accused of gaslighting americans with claim trump is helping victims of human trafficking,[],"['ivanka', 'accused', 'gaslighting', 'americans', 'claim', 'trump', 'helping', 'victims', 'human', 'trafficking']",0.0,2019-10-30 10:56:47
"Gaslighting on Lysol-gate: Now Trump is denying he said what we heard him say - Gaslighting isn't just a fancy word for lying — it's an assault on truth, evidence and our perception of reality",,1588009529.0,11343,345,https://www.salon.com/2020/04/27/gaslighting-on-lysol-gate-now-trump-is-denying-he-said-what-we-heard-him-say/,gaslighting on lysol gate now trump is denying he said what we heard him say gaslighting isn t just a fancy word for lying it s an assault on truth evidence and our perception of reality,[],"['gaslighting', 'lysol', 'gate', 'trump', 'denying', 'said', 'heard', 'say', 'gaslighting', 'fancy', 'word', 'lying', 'assault', 'truth', 'evidence', 'perception', 'reality']",0.0,2020-04-27 17:45:29
Donald Trump is trying to gaslight us on E. Jean Carroll’s account of rape,,1561234755.0,6344,594,https://www.vox.com/policy-and-politics/2019/6/21/18701355/trump-gaslight-e-jean-carroll-rape-sexual-assault,donald trump is trying to gaslight us on e jean carroll s account of rape,[],"['donald', 'trump', 'trying', 'gaslight', 'jean', 'carroll', 'account', 'rape']",0.0,2019-06-22 20:19:15
MTG Accuses Trump of “Gaslighting” America and Ignoring Common Sense - Representative Marjorie Taylor Greene is pissed about the Trump administration’s handling of the Epstein files and the affordability crisis.,,1763138133.0,1068,80,https://newrepublic.com/post/203214/marjorie-taylor-greene-trump-gaslighting-epstein-economy,mtg accuses trump of gaslighting america and ignoring common sense representative marjorie taylor greene is pissed about the trump administration s handling of the epstein files and the affordability crisis,[],"['mtg', 'accuses', 'trump', 'gaslighting', 'america', 'ignoring', 'common', 'sense', 'representative', 'marjorie', 'taylor', 'greene', 'pissed', 'trump', 'administration', 'handling', 'epstein', 'files', 'affordability', 'crisis']",-0.3,2025-11-14 16:35:33
Fox News covers impeachment hearing by defending Trump and gaslighting viewers,,1573696089.0,7273,430,https://www.theguardian.com/us-news/2019/nov/13/fox-news-impeachment-hearing-trump,fox news covers impeachment hearing by defending trump and gaslighting viewers,[],"['fox', 'news', 'covers', 'impeachment', 'hearing', 'defending', 'trump', 'gaslighting', 'viewers']",0.0,2019-11-14 01:48:09
"Republican Senators Are Going Full Gaslight on Impeachment, Which Is Kind of a Concern",,1579797822.0,9105,331,https://www.esquire.com/news-politics/a30641673/republican-senator-mike-braun-trump-impeachment/,republican senators are going full gaslight on impeachment which is kind of a concern,[],"['republican', 'senators', 'going', 'full', 'gaslight', 'impeachment', 'kind', 'concern']",0.475,2020-01-23 16:43:42
Al Gore rips Trump's Covid-19 response: 'He's trying to gaslight the virus',,1600313468.0,8985,264,https://www.cnn.com/2020/09/16/politics/al-gore-trump-coronavirus-cnntv/index.html?utm_source=feedburner&utm_medium=feed&utm_campaign=Feed%3A+rss%2Fcnn_topstories+%28RSS%3A+CNN+-+Top+Stories%29,al gore rips trump s covid 19 response he s trying to gaslight the virus,[],"['gore', 'rips', 'trump', 'covid', 'response', 'trying', 'gaslight', 'virus']",0.0,2020-09-17 03:31:08
Kamala Harris Blames Trump for Abortion Ban: 'Enough With the Gaslighting',,1713007556.0,2747,147,https://www.newsweek.com/kamala-harris-blames-trump-abortion-ban-enough-gaslighting-1890006,kamala harris blames trump for abortion ban enough with the gaslighting,[],"['kamala', 'harris', 'blames', 'trump', 'abortion', 'ban', 'enough', 'gaslighting']",0.0,2024-04-13 11:25:56
ABC Host George Stephanopoulos Pulls Plug on JD Vance Interview,,1760304585.0,40638,1537,https://www.thedailybeast.com/donald-trumps-nemesis-george-stephanopoulos-cuts-jd-vance-off-mid-sentence/,abc host george stephanopoulos pulls plug on jd vance interview,[],"['abc', 'host', 'george', 'stephanopoulos', 'pulls', 'plug', 'vance', 'interview']",0.0,2025-10-12 21:29:45
Rogan: Trump administration ‘gaslighting’ supporters on Epstein,,1753800448.0,1189,80,https://thehill.com/homenews/media/5425209-joe-rogan-trump-administration-epstein-files/,rogan trump administration gaslighting supporters on epstein,[],"['rogan', 'trump', 'administration', 'gaslighting', 'supporters', 'epstein']",0.0,2025-07-29 14:47:28
GOP is still gaslighting about the Capitol riot: Trump's allies claim coup and QAnon never happened. After the riot comes the gaslighting,,1614190800.0,7512,209,https://www.salon.com/2021/02/24/gop-is-still-gaslighting-about-the-capitol-riot-trumps-allies-claim-coup-and-qanon-never-happened/,gop is still gaslighting about the capitol riot trump s allies claim coup and qanon never happened after the riot comes the gaslighting,[],"['gop', 'still', 'gaslighting', 'capitol', 'riot', 'trump', 'allies', 'claim', 'coup', 'qanon', 'never', 'happened', 'riot', 'comes', 'gaslighting']",0.0,2021-02-24 18:20:00
4 false claims in under 30 words: Kevin McCarthy’s IG report tweet is an exercise in gaslighting,,1577193761.0,5750,290,https://www.vox.com/policy-and-politics/2019/12/24/21035288/kevin-mccarthy-ig-report-tweet-broke-into-spied-on-trump?ref=home,4 false claims in under 30 words kevin mccarthy s ig report tweet is an exercise in gaslighting,[],"['false', 'claims', 'words', 'kevin', 'mccarthy', 'report', 'tweet', 'exercise', 'gaslighting']",-0.4000000000000001,2019-12-24 13:22:41
"McConnell Hit With Some Home Truths After Saying He’s ‘Perplexed’ By COVID-19 Vaccine Hesitancy. “This is some hall of fame level gaslighting right here,” one critic hit back at the Kentucky Republican.",,1625862381.0,7754,172,https://m.huffpost.com/us/entry/us_60e7edc0e4b015898510d8c7,mcconnell hit with some home truths after saying he s perplexed by covid 19 vaccine hesitancy this is some hall of fame level gaslighting right here one critic hit back at the kentucky republican,[],"['mcconnell', 'hit', 'home', 'truths', 'saying', 'perplexed', 'covid', 'vaccine', 'hesitancy', 'hall', 'fame', 'level', 'gaslighting', 'right', 'one', 'critic', 'hit', 'back', 'kentucky', 'republican']",0.22857142857142856,2021-07-09 20:26:21
"Contradicted by his own national security team, Trump tries gaslighting",,1549028359.0,7000,263,http://www.msnbc.com/rachel-maddow-show/contradicted-his-own-national-security-team-trump-tries-gaslighting,contradicted by his own national security team trump tries gaslighting,[],"['contradicted', 'national', 'security', 'team', 'trump', 'tries', 'gaslighting']",0.25,2019-02-01 13:39:19
Jan. 6 convicts aren’t ‘hostages’: Judge decries gaslighting,,1712586745.0,2553,120,https://www.washingtonpost.com/opinions/2024/04/08/judge-lamberth-jan6/,jan 6 convicts aren t hostages judge decries gaslighting,[],"['jan', 'convicts', 'hostages', 'judge', 'decries', 'gaslighting']",0.0,2024-04-08 14:32:25
White House Rages at Ariana Grande for Questioning Donald Trump’s Success,,1759194367.0,26964,845,https://www.thedailybeast.com/white-house-rages-at-ariana-grande-for-questioning-donald-trumps-success/,white house rages at ariana grande for questioning donald trump s success,[],"['white', 'house', 'rages', 'ariana', 'grande', 'questioning', 'donald', 'trump', 'success']",0.15,2025-09-30 01:06:07
"Republicans use black woman, Jewish man to gaslight Congress on threat of white nationalism",,1554914195.0,3033,416,https://www.salon.com/2019/04/10/republicans-use-black-woman-jewish-man-to-gaslight-congress-on-threat-of-white-nationalism/,republicans use black woman jewish man to gaslight congress on threat of white nationalism,[],"['republicans', 'use', 'black', 'woman', 'jewish', 'man', 'gaslight', 'congress', 'threat', 'white', 'nationalism']",-0.05555555555555555,2019-04-10 16:36:35
The GOP effort to hide the Epstein Files just hit a disgusting new low: Republicans are attempting to delay swearing in a recently-elected Democratic member of Congress so she can’t become the tie-breaking vote to release the Epstein files.,,1758917252.0,38826,768,https://newrepublic.com/post/201005/gop-effort-hide-epstein-files-just-hit-disgusting-new-low-adelita-graijalva,the gop effort to hide the epstein files just hit a disgusting new low republicans are attempting to delay swearing in a recently elected democratic member of congress so she can t become the tie breaking vote to release the epstein files,[],"['gop', 'effort', 'hide', 'epstein', 'files', 'hit', 'disgusting', 'new', 'low', 'republicans', 'attempting', 'delay', 'swearing', 'recently', 'elected', 'democratic', 'member', 'congress', 'become', 'tie', 'breaking', 'vote', 'release', 'epstein', 'files']",-0.2159090909090909,2025-09-26 20:07:32
JD Vance’s attempt to link Democrats to Epstein renews calls to ‘release the files’,,1754871543.0,41526,1169,https://www.theguardian.com/us-news/2025/aug/10/jd-vance-democrats-jeffrey-epstein-files,jd vance s attempt to link democrats to epstein renews calls to release the files,[],"['vance', 'attempt', 'link', 'democrats', 'epstein', 'renews', 'calls', 'release', 'files']",0.0,2025-08-11 00:19:03
'Gaslighting of the first order': Joe reacts to Vance's calls for the left to 'tone down the rhetoric',,1726581308.0,2109,80,https://www.msnbc.com/morning-joe/watch/-gaslighting-of-the-first-order-joe-reacts-to-vance-s-calls-for-the-left-to-tone-down-the-rhetoric-219506245924,gaslighting of the first order joe reacts to vance s calls for the left to tone down the rhetoric,[],"['gaslighting', 'first', 'order', 'joe', 'reacts', 'vance', 'calls', 'left', 'tone', 'rhetoric']",0.03148148148148148,2024-09-17 13:55:08
You Can’t Gaslight a Virus |,,1583718775.0,3732,249,https://www.nytimes.com/2020/03/08/opinion/trump-coronavirus.html,you can t gaslight a virus,[],"['gaslight', 'virus']",0.0,2020-03-09 01:52:55
"DOJ, FBI conclude Epstein had no ""client list,"" committed suicide",,1751850643.0,24709,2274,https://www.axios.com/2025/07/07/jeffrey-epstein-suicide-client-list-trump-administration,doj fbi conclude epstein had no client list committed suicide,[],"['doj', 'fbi', 'conclude', 'epstein', 'client', 'list', 'committed', 'suicide']",0.0,2025-07-07 01:10:43
"Trump Russiagate papers found in ‘burn bags’ in secret room, FBI claims",,1753971485.0,29564,1180,https://www.thetimes.com/us/american-politics/article/kash-patel-burn-bags-russia-trump-links-6n9zjdwjh,trump russiagate papers found in burn bags in secret room fbi claims,[],"['trump', 'russiagate', 'papers', 'found', 'burn', 'bags', 'secret', 'room', 'fbi', 'claims']",-0.4,2025-07-31 14:18:05
Republicans Are Gaslighting America. Will It Work? Night three of the RNC was more revisionist history.,,1598531258.0,4918,176,https://slate.com/news-and-politics/2020/08/rnc-night-3-pence-trump-kenosha-coronavirus.html,republicans are gaslighting america will it work night three of the rnc was more revisionist history,[],"['republicans', 'gaslighting', 'america', 'work', 'night', 'three', 'rnc', 'revisionist', 'history']",0.5,2020-08-27 12:27:38
Minneapolis mayor warns against 'villainizing trans community' after shooting leaves 2 children dead,,1756329563.0,8143,1868,https://www.advocate.com/crime/minnesota-transgender-church-shooter,minneapolis mayor warns against villainizing trans community after shooting leaves 2 children dead,[],"['minneapolis', 'mayor', 'warns', 'villainizing', 'trans', 'community', 'shooting', 'leaves', 'children', 'dead']",-0.2,2025-08-27 21:19:23
Trump Posted a Photo of Abrego Garcia's Hand With an MS-13 Knuckle Tattoo. Internet Sleuths Say It's Photoshopped,,1745073537.0,36827,3891,https://www.latintimes.com/trump-photo-abrego-garcia-hand-ms-13-knuckle-tattoo-internet-sleuths-photoshopped-581226,trump posted a photo of abrego garcia s hand with an ms 13 knuckle tattoo internet sleuths say it s photoshopped,[],"['trump', 'posted', 'photo', 'abrego', 'garcia', 'hand', 'knuckle', 'tattoo', 'internet', 'sleuths', 'say', 'photoshopped']",0.0,2025-04-19 14:38:57
Trump threatens to block Washington Commanders stadium deal unless team changes back to former name,,1753042239.0,13797,1384,https://www.cbsnews.com/news/trump-washington-commanders-change-back-to-former-name/,trump threatens to block washington commanders stadium deal unless team changes back to former name,[],"['trump', 'threatens', 'block', 'washington', 'commanders', 'stadium', 'deal', 'unless', 'team', 'changes', 'back', 'former', 'name']",0.0,2025-07-20 20:10:39
Behind the GOP gaslighting over Pelosi attack: They know it won't happen to them,,1667244111.0,1731,222,https://www.salon.com/2022/10/31/behind-the-gaslighting-over-pelosi-attack-they-know-it-wont-happen-to-them/,behind the gop gaslighting over pelosi attack they know it won t happen to them,[],"['behind', 'gop', 'gaslighting', 'pelosi', 'attack', 'know', 'happen']",-0.4,2022-10-31 19:21:51
Post-Roe gaslighting: The party of QAnon denies the very real rape of a 10-year-old | A shameful episode in right-wing media is a reminder: Republicans only care about kids when they're imaginary,,1657828754.0,4045,109,https://www.salon.com/2022/07/14/post-roe-gaslighting-the-party-of-qanon-denies-the-very-real-rape-of-a-10-year-old/,post roe gaslighting the party of qanon denies the very real rape of a 10 year old a shameful episode in right wing media is a reminder republicans only care about kids when they re imaginary,[],"['post', 'roe', 'gaslighting', 'party', 'qanon', 'denies', 'real', 'rape', 'year', 'old', 'shameful', 'episode', 'right', 'wing', 'media', 'reminder', 'republicans', 'care', 'kids', 'imaginary']",0.16142857142857142,2022-07-14 19:59:14
"In Pressuring ABC Over Kimmel, Trump May Have Crossed a Constitutional Line",,1758297581.0,6207,1169,https://www.nytimes.com/2025/09/19/us/politics/supreme-court-jimmy-kimmel-free-speech.html,in pressuring abc over kimmel trump may have crossed a constitutional line,[],"['pressuring', 'abc', 'kimmel', 'trump', 'may', 'crossed', 'constitutional', 'line']",0.0,2025-09-19 15:59:41
GOP gaslighting gets weirder: Why Trump and Vance spread lies about race and gender,,1722855041.0,1607,89,https://www.salon.com/2024/08/05/gaslighting-gets-weirder-why-and-vance-spread-lies-about-race-and-gender/,gop gaslighting gets weirder why trump and vance spread lies about race and gender,[],"['gop', 'gaslighting', 'gets', 'weirder', 'trump', 'vance', 'spread', 'lies', 'race', 'gender']",0.0,2024-08-05 10:50:41
Donald Trump’s ‘Gaslighting’ Over Fox News Interview Goes Awry,,1595339688.0,2983,196,https://www.huffpost.com/entry/donald-trump-chris-wallace-reviews-tweet_n_5f16cff5c5b6cac5b731784b,donald trump s gaslighting over fox news interview goes awry,[],"['donald', 'trump', 'gaslighting', 'fox', 'news', 'interview', 'goes', 'awry']",0.0,2020-07-21 13:54:48
